{"contract_id":"moontown.pack-candidate-intake.v1","candidate_ref":"town/candidates/test-a-shared-export-workflow-mv6f7f40","origin_ref":"town/ideas/test-a-shared-export-workflow","target_pack_id":"bridge-fixture","intake_operation_id":"fixture.candidate.intake","submitted_by":"moontown-operator","submitted_at":"2026-10-13T08:30:00.000Z","title":"Test a shared export workflow","rationale":"Two locally changed signals suggest an interview, not a product commitment.","claim_ceiling":"research-evidence","evidence_refs":["evidence/demand.json","evidence/export.json"],"domain_payload":{"experiment_kind":"interview","moontown_source_context":{"contract_id":"moontown.source-linked-candidate.v1","authorship":"Operator-authored proposal; selected packs have not endorsed it.","accepted_knowledge":false,"genuine_emergence_verified":false,"uncertainty":"Reject if matched interviews show this was temporary reporting noise.","sources":[{"pack_id":"bridge-fixture","product_id":"bridge-fixture","pack_version":"1.0.0","captured_generated_at":"2026-10-13T08:00:00Z","subject_ref":"observations/demand.json","schema_id":"fixture-draft","title":"demand signal","summary":"Three interviewees now request a shared export.","lifecycle_state":"draft","evidence_refs":["evidence/demand.json"],"connection":"Ask whether the changed workflow recurs under the same conditions."},{"pack_id":"second-fixture","product_id":"second-fixture","pack_version":"1.0.0","captured_generated_at":"2026-10-13T08:00:00Z","subject_ref":"observations/export.json","schema_id":"fixture-draft","title":"export signal","summary":"A second domain reports repeated copy/paste into spreadsheets.","lifecycle_state":"draft","evidence_refs":["evidence/export.json"],"connection":"Ask whether the changed workflow recurs under the same conditions."}],"observation_changes":{"contract_id":"moontown.observation-change-review.v1","accepted_knowledge":false,"baseline_label":"Monday field notes","baseline_saved_at":"2026-10-12T13:00:00Z","scope_pack_ids":["bridge-fixture","second-fixture"],"interpretation":"Exact projected-field comparison within saved pack scope. Publisher timestamps alone are ignored. Not semantic importance, verified evidence bytes, removed knowledge or pack endorsement.","selected_changes":[{"key":"[\"bridge-fixture\",\"observations/demand.json\"]","status":"changed","changed_fields":["summary"],"before":{"pack_id":"bridge-fixture","product_id":"bridge-fixture","pack_version":"1.0.0","captured_generated_at":"2026-10-12T12:00:00Z","subject_ref":"observations/demand.json","schema_id":"fixture-draft","title":"demand signal","summary":"Earlier demand observation","lifecycle_state":"draft","evidence_refs":["evidence/demand.json"]},"after":{"pack_id":"bridge-fixture","product_id":"bridge-fixture","pack_version":"1.0.0","captured_generated_at":"2026-10-13T08:00:00Z","subject_ref":"observations/demand.json","schema_id":"fixture-draft","title":"demand signal","summary":"Three interviewees now request a shared export.","lifecycle_state":"draft","evidence_refs":["evidence/demand.json"]}},{"key":"[\"second-fixture\",\"observations/export.json\"]","status":"newly-projected","changed_fields":[],"before":null,"after":{"pack_id":"second-fixture","product_id":"second-fixture","pack_version":"1.0.0","captured_generated_at":"2026-10-13T08:00:00Z","subject_ref":"observations/export.json","schema_id":"fixture-draft","title":"export signal","summary":"A second domain reports repeated copy/paste into spreadsheets.","lifecycle_state":"draft","evidence_refs":["evidence/export.json"]}}],"omitted_change_count":1,"gaps":[]}}}}
