{"contract_id":"moontown.pack-candidate-intake.v1","candidate_ref":"town/candidates/investigate-shared-spreadsheet-export-friction-mv6ga000","origin_ref":"town/ideas/investigate-shared-spreadsheet-export-friction","target_pack_id":"bridge-fixture","intake_operation_id":"fixture.candidate.intake","submitted_by":"moontown-operator","submitted_at":"2026-10-13T09:00:00.000Z","title":"Investigate shared spreadsheet export friction","rationale":"Check whether customer reporting and field research need a common export primitive.","claim_ceiling":"research-evidence","evidence_refs":["evidence/interviews.json","evidence/field-notes.json"],"domain_payload":{"experiment_kind":"interview","moontown_source_context":{"contract_id":"moontown.source-linked-candidate.v1","authorship":"Operator-authored proposal; selected packs have not endorsed it.","accepted_knowledge":false,"genuine_emergence_verified":false,"uncertainty":"Reject if these audiences need incompatible formats or the shared word hides different jobs.","sources":[{"pack_id":"bridge-fixture","product_id":"bridge-fixture","pack_version":"1.0.0","captured_generated_at":"2026-10-13T08:00:00Z","subject_ref":"observations/interviews.json","schema_id":"fixture-draft","title":"interviews signal","summary":"Customers request spreadsheet export for monthly reporting.","lifecycle_state":"draft","evidence_refs":["evidence/interviews.json"],"connection":"The excerpt names spreadsheet export; compare dates and actual user needs before drawing a conclusion."},{"pack_id":"second-fixture","product_id":"second-fixture","pack_version":"1.0.0","captured_generated_at":"2026-10-13T08:00:00Z","subject_ref":"observations/field-notes.json","schema_id":"fixture-draft","title":"field-notes signal","summary":"Researchers manually export spreadsheet data after field visits.","lifecycle_state":"draft","evidence_refs":["evidence/field-notes.json"],"connection":"The excerpt names spreadsheet export; compare dates and actual user needs before drawing a conclusion."}],"vocabulary_discovery":{"contract_id":"moontown.vocabulary-review.v1","accepted_knowledge":false,"interpretation":"Shared words are navigation hints, not semantic similarity, independent corroboration, agreement or contradiction. Exact excerpts and pack-relative sources require operator review.","lens":{"contract_id":"moontown.vocabulary-lens.v1","method":"nfkc-lowercase-unicode-word-runs-v1","accepted_knowledge":false,"label":"A shared export need?","scope_pack_ids":["bridge-fixture","second-fixture"],"mode":"any","terms":["export"],"ignored_suggestions":["signal"]},"operator_hypothesis":"Different domains describe manual spreadsheet exports.","inspected_observation_count":4,"matching_observation_count":3,"omitted_match_count":1,"gaps":[],"selected_matches":[{"pack_id":"bridge-fixture","subject_ref":"observations/interviews.json","matched_terms":["export"]},{"pack_id":"second-fixture","subject_ref":"observations/field-notes.json","matched_terms":["export"]}]}}}}
